{
  "$schema": "../schemas/item.schema.json",
  "id": "river-stone",
  "name": "River Stone",
  "shortDescription": "A smooth stone from the mill-race.",
  "examineDescription": "A grey stone worn flat and smooth on both faces, about the width of two paws. It sat in a pocket of fast water under the mill race long enough for the current to polish it. It is cold, it stays cold, and there is nothing else remarkable about it.",
  "category": "ordinary",
  "unique": true
}
