{
  "$schema": "../schemas/item.schema.json",
  "id": "queen-silk-cord",
  "name": "Queen Silk Cord",
  "shortDescription": "A heavy cord from the split cradle.",
  "examineDescription": "The cord is as thick as a thumb and pale as old candlewax. It holds a low note when you draw it taut. This is not decoration. Three Collegians earned it, and Alder will want the report before anyone wears it as a prize.",
  "category": "ordinary",
  "unique": true
}
