{
  "$schema": "../schemas/item.schema.json",
  "id": "copied-still-score",
  "name": "Copied Still Score",
  "shortDescription": "A careful copy of the still score.",
  "examineDescription": "Alder let you keep this copy after the Deep Cradle. Three notes match the oak. The fourth space is drawn as a small circle with two dots. You remember the button was warm.",
  "category": "ordinary",
  "unique": true
}
