{
  "$schema": "../schemas/item.schema.json",
  "id": "boarding-oar",
  "name": "Boarding Oar",
  "shortDescription": "A short oar, notched, not bloody.",
  "examineDescription": "A short oar, notched where it met a rail. Skipper Marram calls it a tool for keeping a boat yours. Wear it in the main paw if you mean to. It is wood and tar, not a speech.",
  "category": "ordinary",
  "unique": true,
  "equipSlot": "main-hand"
}
